<?xml version="1.0"?>
<?xml-stylesheet href="lib/help.xsl" type="text/xsl"?>

<revbayes-help
	xmlns="http://www.revbayes.org/schema/help-entry"
	xmlns:xsi="http://www.w3.org/2001/XMLSchema-instance"
	xsi:schemaLocation="http://www.revbayes.org/schema/help-entry lib/rb-help-entry.xsd"
>
    <function-help-entry>
    
        <name>mapTree</name>

        <title>Maximum a posteriori tree</title>
    
        <description>
            <p>
            Finds the tree with the highest posterior probability.
            </p>
        </description>

        <usage>
            <![CDATA[
             mapTree( TreeTrace treetrace, String file )
             ]]> 
        </usage>
    
        <argument>
            <label>treetrace</label>
            <argumentPassingMethod>by-value</argumentPassingMethod>
            <argumentNodeType>any-DAG-node</argumentNodeType>
            <description>The tree trace in which we will search for the tree with the highest posterior probability.</description>
            <valueType>TreeTrace</valueType>
        </argument>
        <argument>
            <label>file</label>
            <argumentPassingMethod>by-value</argumentPassingMethod>
            <argumentNodeType>any-DAG-node</argumentNodeType>
            <description>A description of the argument.</description>
            <valueType>String</valueType>
        </argument>

        <returnValue>Tree, RevObject</returnValue>

        <details>
            <!-- Since this section can be lengthy, the text is sectioned with <p> tags -->
            <p>
            This function searches through the tree trace and finds the topology with the most occurrences (highest posterior probability).
            Then, we use the mean branch lengths or node ages to build the tree.
            </p>
        </details>

        <example>
            <![CDATA[
             treetrace = readTreeTrace("output/primates.trees", treetype="non-clock")
             mapTree(treetrace,"output/primates_map.tree")
             ]]>

        </example>

        <author>Sebastian Hoehna</author>

        <seeAlso>
            <!-- The xslt page will try to auto generate links to the referred help entries, therefore only exact names of help items should be listed here (case sensitive) -->
            <entry>readTreeTrace</entry>
        </seeAlso>


    </function-help-entry>

</revbayes-help>

