<?xml version="1.0"?>
<?xml-stylesheet href="lib/help.xsl" type="text/xsl"?>

<revbayes-help
	xmlns="http://www.revbayes.org/schema/help-entry"
	xmlns:xsi="http://www.w3.org/2001/XMLSchema-instance"
	xsi:schemaLocation="http://www.revbayes.org/schema/help-entry lib/rb-help-entry.xsd"
>
    <function-help-entry>
    
        <name>normalize</name>

        <title>Normalize a vector of values</title>
    
        <description>
            <p>
            'normalize' scales all vector elements by some constant such that their new average equals 'sum'.
            </p>
        </description>

        <usage>
            <![CDATA[
             normalize( RealPos[] x, RealPos sum = 1 )
             ]]> 
        </usage>
    
        <argument>
            <label>x</label>
            <argumentPassingMethod>by-const-reference</argumentPassingMethod>
            <argumentNodeType>any-DAG-node</argumentNodeType>
            <description>A description of the argument.</description>
            <valueType>RealPos[]</valueType>
        </argument>
        <argument>
            <label>sum</label>
            <argumentPassingMethod>by-const-reference</argumentPassingMethod>
            <argumentNodeType>any-DAG-node</argumentNodeType>
            <description>A description of the argument.</description>
            <valueType>RealPos</valueType>
            <defaultValue>1</defaultValue>
        </argument>

        <returnValue>RealPos[], ModelObject, RevObject</returnValue>

        <details>
            <!-- Since this section can be lengthy, the text is sectioned with <p> tags -->
            <p>
            'normalize' computes the mean of 'x', divides all elements in 'x' by that mean, then multiplies by the value 'sum'. This results in the mean of 'normalize(x)' equaling 'sum'.
            </p>
        </details>

        <example>
            <![CDATA[
            > x <- [1, 1, 3]
            > y := normalize(x, 4.0)
            > y
               [ 2, 4, 6 ]

            ]]>

        </example>

        <author>Michael Landis</author>

        <seeAlso>
            <!-- The xslt page will try to auto generate links to the referred help entries, therefore only exact names of help items should be listed here (case sensitive) -->
            <entry>similar function</entry>
        </seeAlso>


    </function-help-entry>

</revbayes-help>

