<?xml version="1.0"?>
<?xml-stylesheet href="lib/help.xsl" type="text/xsl"?>

<revbayes-help
	xmlns="http://www.revbayes.org/schema/help-entry"
	xmlns:xsi="http://www.w3.org/2001/XMLSchema-instance"
	xsi:schemaLocation="http://www.revbayes.org/schema/help-entry lib/rb-help-entry.xsd"
>
    <function-help-entry>
    
        <name>rcat</name>

        <title>Random Variables from The Categorical Distribution</title>
    
        <description>
            <p>
            This function generates random draws from the categorical distribution.
            The desired number of random draws is specified by the argument n, and
            the probability of the outcomes is specified by the simplex parameter p.
            The outcomes are labeled from 1 to K, and each outcome i has the
            probability given by element i in the simplex p.
            </p>
        </description>

        <usage>
            <![CDATA[
             rcat( Natural n, Simplex p )
             ]]> 
        </usage>
    
        <argument>
            <label>n</label>
            <argumentPassingMethod>by-value</argumentPassingMethod>
            <argumentNodeType>any-DAG-node</argumentNodeType>
            <description>The desired number of draws.</description>
            <valueType>Natural</valueType>
            <defaultValue>1</defaultValue>
        </argument>
        <argument>
            <label>p</label>
            <argumentPassingMethod>by-const-reference</argumentPassingMethod>
            <argumentNodeType>any-DAG-node</argumentNodeType>
            <description>The probability of the outcomes.</description>
            <valueType>Simplex</valueType>
        </argument>

        <returnValue>Natural[]</returnValue>

        <details>
            <!-- Since this section can be lengthy, the text is sectioned with <p> tags -->
            <p>
            See dnCat for details.
            </p>
        </details>

        <example>
            <![CDATA[
             # Draw 10 values from a categorical distribution
             # with the outcome probabilities being 0.1, 0.2,
             # 0.3, and 0.4, respectively. Examine the value
             # afterwards. Note that the outcomes will be
             # in the space { 1, 2, 3, 4 }
             x <- rcat( 10, simplex(0.1, 0.2, 0.3, 0.4) )
             x
             ]]>

        </example>

        <author>Fredrik Ronquist</author>

        <seeAlso>
            <!-- The xslt page will try to auto generate links to the referred help entries, therefore only exact names of help items should be listed here (case sensitive) -->
            <entry>dnCat</entry>
            <entry>dcat</entry>
        </seeAlso>


    </function-help-entry>

</revbayes-help>

