<?xml version="1.0"?>
<?xml-stylesheet href="lib/help.xsl" type="text/xsl"?>

<revbayes-help
    xmlns="http://www.revbayes.org/schema/help-entry"
    xmlns:xsi="http://www.w3.org/2001/XMLSchema-instance"
    xsi:schemaLocation="http://www.revbayes.org/schema/help-entry lib/rb-help-entry.xsd"
>
    <function-help-entry>

        <name>cBDP</name>

        <title>Constant-rate birth-death process</title>

        <description>
            <p>
                The constant-rate birth-death process species a prior probability distribution on time trees. The birth (speciation) and death (extinction)
                rates are assumed to be constant over time. Unlike some implementations, cBDP does not constrain the birth rate to be larger than the death
                rate.
            </p>
        </description>

        <usage>
        <![CDATA[
        ConstBDProcess cBDP(
                             RealPos        lambda,
                             RealPos        mu = 0.0,
                             RealPos        origin,
                             Probability    rho = 1.0,
                             String         samplingStrategy="uniform",
                             String         condition="survival",
                             Natural        nTaxa,
                             Vector<String> names,
                             Vector<Clade>  constraints
                           )
        ]]>
        </usage>

        <argument>
            <label>lambda</label>
            <argumentType>dynamic</argumentType>
            <description>Birth (speciation) rate.</description>
            <valueType>Positive real number</valueType>
        </argument>
        <argument>
            <label>mu</label>
            <description>Death (extinction) rate.</description>
            <argumentType>dynamic</argumentType>
            <valueType>Positive real number</valueType>
        </argument>
        <argument>
            <label>origin</label>
            <description>The time of the process since the origin, i.e., the length of the stem branch plus the crown age.</description>
            <argumentType>dynamic</argumentType>
            <valueType>Positive real number</valueType>
        </argument>
        <argument>
            <label>rho</label>
            <description>The taxon sampling probability/fraction.</description>
            <argumentType>dynamic</argumentType>
            <valueType>Positive real number between 0.0 and 1.0</valueType>
            <defaultValue>1.0</defaultValue>
        </argument>
        <argument>
            <label>samplingStrategy</label>
            <description>The sampling strategy used if the taxon sampling is incomplete.</description>
            <argumentType>fixed</argumentType>
            <valueType>String</valueType>
            <option>"uniform"</option>
            <option>"diversified"</option>
            <defaultValue>"uniform"</defaultValue>
        </argument>
        <argument>
            <label>condition</label>
            <description>Conditioning of the process. For details, see below.</description>
            <argumentType>fixed</argumentType>
            <valueType>String</valueType>
            <option>"time"</option>
            <option>"survival"</option>
            <option>"tree"</option>
            <option>"nTaxa"</option>
            <defaultValue>time</defaultValue>
        </argument>
        <argument>
            <label>nTaxa</label>
            <argumentType>fixed</argumentType>
            <description>The number of taxa. This is only needed for simulation/initialization purposes when a tree with exactly n taxa is needed in the model.</description>
            <valueType>Natural number</valueType>
        </argument>
        <argument>
            <label>names</label>
            <argumentType>fixed</argumentType>
            <description>The taxon labels that will be applied to the simulated tree.</description>
            <valueType>Vector of strings</valueType>
        </argument>
        <argument>
            <label>constraints</label>
            <argumentType>fixed</argumentType>
            <description>The topological constraints applied to the tree, i.e., conditioning on the occurence of the split between the clade and the remaining tree.</description>
            <valueType>Vector of clades</valueType>
            <defaultValue>NULL</defaultValue>
        </argument>

        <returnValue>TimeTree</returnValue>

        <details>
            <!-- Since this section can be lengthy, the text is sectioned with <p> tags -->
            <p>
                The implementation of the constant-rate birth-death process is based on Nee et al. (1994). The unconditioned process results in an improper probability
                distribution, so the process needs to be conditioned on something. Possibilities include to condition the process on the time (duration), on survival
                (non-extinction), on obtaining a tree, or on obtaining the number of observed taxa. The condition of the process is controlled by the 'condition' 
                parameter.
            </p>
            <p>
                The process gives rise to trees with extinct branches, but observed trees typically do not include extinct branches. As implemented here, we
                assume that it is trees without extinct branches, so-called reconstructed trees, that we observe. The probability distribution is modified accordingly.
            </p>
            <p>
                It is commonly the case that the observed tree does not include all tips. The included tips may have been sampled uniformly at random from the available
                complete tree. A particularly common bias is that the investigator has tried to maximize the diversity in the sampled tree, by including tips that are as
                distantly related to each other as possible. This is referred to as diversified sampling. It is critical to model the sampling process
                correctly to obtain accurate estimates of the birth and death rates (Hoehna et al. 2011); particularly the estimate of the death rate is sensitive to
                violations of the sampling assumptions.
            </p>

        </details>

        <example>
        <![CDATA[
        trueTree <- readTrees("data/primate.tree")[1]
        
        names <- trueTree.names()
        taxaCount <- names.size()
        
        # Birth-Death process priors
        speciation ~ exponential(0.1)
        extinction ~ exponential(0.1)
        org ~ unif(0.0,50.0)
        
        # moves for the birth-death parameters
        moves[1] <- mScale(speciation, lambda=1, tune=true, weight=2)
        moves[2] <- mScale(extinction, lambda=1, tune=true, weight=2)
        moves[3] <- mSlide(org, delta=1.0, weight=2.0)
       
        # tree from birth-death process
        tau ~ cBDP(origin=org, lambda=speciation, mu=extinction, nTaxa=taxaCount, names=names)
       
        tau.clamp( trueTree )
        
        monitors[1] <- modelmonitor(filename="testBirthDeath.log",printgen=10, separator = "	")
        monitors[2] <- screenmonitor(printgen=1000, separator = "	", speciation)
        
        mymodel <- model(tau)
        
        mymcmc <- mcmc(mymodel, monitors, moves)
        
        mymcmc.burnin(generations=20000,tuningInterval=100)
        mymcmc.run(generations=200000)
        mymcmc.operatorSummary()
        ]]>
       
        </example>

        <reference>
            <citation>
                Nee, S., May, R.M., and Harvey, P.H. 1994. The Reconstructed Evolutionary Process. Philosophical Transactions: Biological Sciences, 344, 305-311
            </citation>
            <url>http://rstb.royalsocietypublishing.org/content/344/1309/305.short</url>
            <doi>10.1098/rstb.1994.0068</doi>
        </reference>
        <reference>
            <citation>
                HÃ¶hna, S., Stadler, T., Ronquist, F, and Britton, T. 2011. Inferring speciation and extinction rates under different species sampling scheme.s Molecular Biology and Evolution, 28, 2577-2589.
            </citation>
            <url>http://mbe.oxfordjournals.org/content/28/9/2577.short</url>
            <doi>10.1093/molbev/msr095</doi>
        </reference>
        
        <author>Sebastian Hoehna</author>
    
        <seeAlso>
            <!-- The xslt page will try to auto generate links to the referred help entries, therefore
            only exact names of help items should be listed here (case sensitive) -->
            <entry>diversityDependentBirthDeathProcess</entry>
        </seeAlso>
    
        

    </function-help-entry>
</revbayes-help>
